{
  "schema_version": "1.0.0",
  "user_profile": {
    "user_id": "user-0001",
    "height_cm": 175.2,
    "weight_kg": 68.4
  },
  "static_biometrics": {
    "measurement_method": "t_pose_image_estimation",
    "left_upper_arm_m": 0.29,
    "right_upper_arm_m": 0.29,
    "left_forearm_m": 0.25,
    "right_forearm_m": 0.25,
    "left_thigh_m": 0.43,
    "right_thigh_m": 0.43,
    "left_shin_m": 0.39,
    "right_shin_m": 0.39,
    "shoulder_width_m": 0.41,
    "torso_length_m": 0.58
  },
  "video_metadata": {
    "video_id": "climb-video-20260312-001",
    "frame_width": 1080,
    "frame_height": 1920,
    "fps": 30.0,
    "total_frames": 2,
    "duration_ms": 67,
    "is_mirrored": false
  },
  "holds": [
    {
      "hold_id": "H01",
      "hold_no": 1,
      "color": "red",
      "bbox_px": {
        "x1": 120,
        "y1": 1440,
        "x2": 210,
        "y2": 1535
      },
      "center_px": {
        "x": 165.0,
        "y": 1487.5
      },
      "is_start_hold": true,
      "is_top_hold": false
    },
    {
      "hold_id": "H02",
      "hold_no": 2,
      "color": "red",
      "bbox_px": {
        "x1": 760,
        "y1": 420,
        "x2": 860,
        "y2": 515
      },
      "center_px": {
        "x": 810.0,
        "y": 467.5
      },
      "is_start_hold": false,
      "is_top_hold": true
    }
  ],
  "frames": [
    {
      "frame_index": 0,
      "timestamp_ms": 0,
      "pose_detected": true,
      "pose_world_landmarks": [
        { "x": 0.02, "y": -0.73, "z": -0.18 },
        { "x": 0.01, "y": -0.75, "z": -0.17 },
        { "x": 0.01, "y": -0.75, "z": -0.17 },
        { "x": 0.01, "y": -0.75, "z": -0.17 },
        { "x": 0.03, "y": -0.75, "z": -0.17 },
        { "x": 0.03, "y": -0.75, "z": -0.17 },
        { "x": 0.03, "y": -0.75, "z": -0.17 },
        { "x": -0.03, "y": -0.72, "z": -0.15 },
        { "x": 0.07, "y": -0.72, "z": -0.15 },
        { "x": -0.01, "y": -0.68, "z": -0.16 },
        { "x": 0.05, "y": -0.68, "z": -0.16 },
        { "x": -0.16, "y": -0.56, "z": -0.03 },
        { "x": 0.17, "y": -0.56, "z": -0.03 },
        { "x": -0.26, "y": -0.38, "z": 0.03 },
        { "x": 0.28, "y": -0.40, "z": 0.03 },
        { "x": -0.34, "y": -0.18, "z": 0.08 },
        { "x": 0.35, "y": -0.21, "z": 0.07 },
        { "x": -0.36, "y": -0.15, "z": 0.08 },
        { "x": 0.37, "y": -0.19, "z": 0.07 },
        { "x": -0.35, "y": -0.14, "z": 0.07 },
        { "x": 0.36, "y": -0.18, "z": 0.06 },
        { "x": -0.33, "y": -0.17, "z": 0.08 },
        { "x": 0.34, "y": -0.22, "z": 0.07 },
        { "x": -0.11, "y": -0.20, "z": -0.02 },
        { "x": 0.11, "y": -0.20, "z": -0.02 },
        { "x": -0.12, "y": 0.12, "z": 0.01 },
        { "x": 0.12, "y": 0.12, "z": 0.01 },
        { "x": -0.14, "y": 0.44, "z": 0.03 },
        { "x": 0.14, "y": 0.44, "z": 0.03 },
        { "x": -0.15, "y": 0.47, "z": 0.06 },
        { "x": 0.15, "y": 0.47, "z": 0.06 },
        { "x": -0.18, "y": 0.53, "z": 0.14 },
        { "x": 0.18, "y": 0.53, "z": 0.14 }
      ],
      "pose_landmarks": [
        { "x": 0.50, "y": 0.11, "z": -0.21 },
        { "x": 0.49, "y": 0.10, "z": -0.21 },
        { "x": 0.49, "y": 0.10, "z": -0.21 },
        { "x": 0.49, "y": 0.10, "z": -0.21 },
        { "x": 0.51, "y": 0.10, "z": -0.21 },
        { "x": 0.51, "y": 0.10, "z": -0.21 },
        { "x": 0.51, "y": 0.10, "z": -0.21 },
        { "x": 0.47, "y": 0.11, "z": -0.18 },
        { "x": 0.53, "y": 0.11, "z": -0.18 },
        { "x": 0.48, "y": 0.12, "z": -0.19 },
        { "x": 0.52, "y": 0.12, "z": -0.19 },
        { "x": 0.42, "y": 0.20, "z": -0.05 },
        { "x": 0.58, "y": 0.20, "z": -0.05 },
        { "x": 0.35, "y": 0.29, "z": 0.03 },
        { "x": 0.63, "y": 0.30, "z": 0.03 },
        { "x": 0.29, "y": 0.40, "z": 0.10 },
        { "x": 0.69, "y": 0.41, "z": 0.09 },
        { "x": 0.28, "y": 0.39, "z": 0.10 },
        { "x": 0.70, "y": 0.40, "z": 0.09 },
        { "x": 0.29, "y": 0.38, "z": 0.09 },
        { "x": 0.69, "y": 0.39, "z": 0.08 },
        { "x": 0.30, "y": 0.39, "z": 0.10 },
        { "x": 0.68, "y": 0.41, "z": 0.09 },
        { "x": 0.45, "y": 0.47, "z": -0.04 },
        { "x": 0.55, "y": 0.47, "z": -0.04 },
        { "x": 0.44, "y": 0.63, "z": 0.01 },
        { "x": 0.56, "y": 0.63, "z": 0.01 },
        { "x": 0.43, "y": 0.80, "z": 0.04 },
        { "x": 0.57, "y": 0.80, "z": 0.04 },
        { "x": 0.42, "y": 0.82, "z": 0.07 },
        { "x": 0.58, "y": 0.82, "z": 0.07 },
        { "x": 0.41, "y": 0.86, "z": 0.14 },
        { "x": 0.59, "y": 0.86, "z": 0.14 }
      ]
    },
    {
      "frame_index": 1,
      "timestamp_ms": 33,
      "pose_detected": false,
      "pose_world_landmarks": null,
      "pose_landmarks": null
    }
  ]
}
